Id,Daerah Asal,Judul Resep,Bahan,Langkah Pembuatan
76,Jambi,Gulai Terjun,"1/2 kg daging sapi, 3 buah cabe merah besar, 4 buah cabe rawit merah, 2 siung bawang putih, 4 butir bawang merah, 1/2 sendok teh adas manis, 1/4 buah biji pala, 1 cm kunyit, 1 cm jahe, 2 cm lengkuas, 1 sendok teh ketumbar, 1 batang serai geprek, 2 lembar daun jeruk, 2 buah asam kandis, 100 gr cabe hijau keriting, 1 gelas santan kental, 500 ml air, 100 gr kelapa parut untuk di sangrai, Bawang goreng untuk taburan, secukupnya Garam","Potong daging sapi kecil-kecil, kemudian cincang biar nantinya bumbu meresap ke dalam daging dan daging cepat matang. Cara membuat sangrai kelapa : kelapa parut sangrai sampai kering kekuningan, kemudian haluskan dengan sedikit air. Sisihkan. Haluskan bumbu : cabe merah, cabe rawit, bawang putih, bawang merah, kunyit, jahe, lengkuas, adas manis, ketumbar, pala, kecuali sereh, daun jeruk dan asam kandis biarkan utuh. Siapkan panci, masukkan daging yang sudah di potong-potong tadi, tuang bumbu yang sudah dihaluskan, tambahkan sereh, asam kandis, santan, air, masak hingga daging terendam air, tutup pancinya, biarkan sampai mendidih dan matang, kira-kira 30 menit. Sesekali aduk-aduk biar santan tidak meluber ke panci. Setelah 30 menit masukkan kelapa sangrai yang sudah dihaluskan tadi, tambahkan garam dan cabe hijau keriting, aduk-aduk, biarkan mendidih selama 10 menit lagi, selesai. Gulai terjun siap dinikmati."
77,Jambi,Sate Rangkayo Hitam,"250 gr tempe, potong dadu, 100 gr kacang tanah, goreng dan giling halus, 50 gr gula aren, 1 sdm gula pasir, 1 sdm kecap manis, ½ sdt asam jawa, 1 sdt penyedap rasa, ½ sdt garam halus, 3 lbr daun salam, 3 lbr daun jeruk purut, 300 ml santan kelapa dengan kekentalan sedang, 5 sdm minyak sayur, Bumbu halus: ½ sdm ketumbar sangrai, 50 gr cabe merah keriting, 30 gr cabe rawit merah besar, 30 gr bawang putih, 20 gr bawang merah, Bahan pelengkap: 3 buah lontong daun, 1 buah jeruk kunci, Acar timun dan wortel, Bawang merah goreng","Panaskan minyak sayur dengan api sedang, tumis bumbu halus, daun salam, daun jeruk purut hingga tidak berbau langu. Masukkan kacang tanah, asam jawa, kecap manis, gula aren, gula pasir, penyedap rasa, dan garam halus, aduk rata. Tuangkan santan kelapa dan masak hingga gula larut. Masukkan potongan tempe, aduk rata dan masak hingga meresap dan kuah kacang mengental. Matikan kompor dan biarkan hingga uap panasnya hilang. Tusuk tempe berbumbu dengan tusuk sate dan panggang. Sajikan sate Rangkayo Hitam bersama saus kacang, lontong, acar timun, dan wortel, perasan sari jeruk kunci jika suka serta beri taburan bawang merah goreng."
78,Jambi,Nasi Gemuk,"3 cup beras, Secukupnya air untuk menanak nasi, 1 ruas lengkuas, geprek, 1 batang serai, geprek, 1 lembar daun salam, 2 lembar daun pandan, simpulkan, 1 lembar daun jeruk, sobek-sobek, 1 bungkus santan instant, ukuran 65 gr, Bumbu yang dihaluskan: 5 siung bawang merah, 3 siung bawang putih, 1 sdt ketumbar, 1/4 sdt jintan, 1 sdt garam, Pelengkap: Secukupnya suwiran ayam, Secukupnya kacang tanah goreng, Secukupnya teri/ikan asin goreng, 4 butir telur rebus, Secukupnya sambal terasi","Cuci beras lalu tempatan pada panci penanak, beri sebagian bumbu halus dan aneka rempah daunnya serta santan. Tuang air sebagaimana ukuran memasak nasi. Masak dengan menggunakan magic com. Biarkan matang dan tanak. Bahan ayam suwir: rebus dada ayam dengan sisa bumbu halus tadi. Beri daun jeruk dan salam. Masak hingga bumbu menyusut dan ayam empuk. Suwir-suwir. Sajikan nasi gemuk bersama pelengkapnya."
79,Jambi,Gulai Talang,"500 gr Ayam, secukupnya Minyak u/ menumis, 500-700 ml Air, secukupnya Gula, Garam dan Kaldu Bubuk, Bumbu Halus: 6 buah Bawang Merah, 3 siung Bawang Putih, 1/2 sdt Ketumbar, 2 ruas Kunyit, 1 ruas Lengkuas, 1 ruas Jahe, 1/2 ons / 15 gr Cabe Rawit Hijau, Rempah-rempah: 1 batang Serai, 2 helai Daun Jeruk, 2 helai Daun Salam, 1 jempol Asam Jawa, Bahan Tambahan: 4 buah Bawang Merah, iris tipis, 1 siung Bawang Putih, iris tipis, secukupnya Cabe Rawit Hijau utuh","Goreng hingga kecoklatan Bawang Merah dan Putih, angkat sisihkan. Tumis Bumbu Halus hingga harum. Tambahkan Rempah-rempah. Masak Bumbu Halus hingga tanak. ± 3 mins masukkan Ayam, aduk merata. Biarkan hingga 5 mins supaya bumbu merasuk"
80,Jambi,Rendang Khas Jambi,"500 gram daging sapi, potong kotak tipis memotong serat, 4 gelas santan encer dari 1,5 kelapa tua, 1 buah pekak, 2 lembar daun salam, 5 lembar daun jeruk, 1/2 lembar daun kunyit, 2 batang kiamis, 2 buah cengkeh, 1 sdt kaldu sapi bubuk, 1 sdt garam, Secukupnya kecap manis, 5 sdm minyak goreng, 150 gram kelapa parut, sangrai, ulek hingga berminyak, Bumbu yang dihaluskan: 15 buah cabe merah keriting, 8 siung bawang merah, 3 siung bawang putih, 4 butir kemiri, 2 ruas laos/lengkuas, 2 ruas jahe, 1 batang serai, 1 sdt ketumbar, 1/2 sdt merica, 1/4 sdt jintan, 1/4 bagian buah pala","Panaskan minyak, tumis bumbu halus sampe harum. Masukkan semua sisa bahan termasuk daging, kecuali santan kental dan kelapa sangrai. Didihkan dengan api sedang sampai daging empuk sambil sesekali diaduk. Setelah daging mulai empuk, masukkan santan kental, masak hingga kuah hampir susut sambil terus diaduk agar bagian bawah tidak gosong. Lalu masukkan kelapa sangrai, masak hingga kuah kering. Koreksi rasa. Sajikan."
